{
  "$schema": "https://json-schema.org/draft/2020-12/schema",
  "$defs": {
    "encryption-keyset": {
      "type": "object",
      "additionalProperties": false,
      "required": ["format_version", "encryption_domain_id", "provider", "endpoint", "bucket", "key_generation", "operational_identity", "operational_recipient", "recovery_recipients"],
      "properties": {
        "format_version": { "const": 1 },
        "encryption_domain_id": { "type": "string", "format": "uuid" },
        "provider": { "enum": ["r2", "minio"] },
        "endpoint": { "type": "string", "format": "uri", "pattern": "^https?://[^:/@?#][^/@?#]*(?:[/?#].*)?$" },
        "bucket": { "type": "string", "minLength": 3, "maxLength": 63 },
        "key_generation": { "type": "integer", "minimum": 1 },
        "operational_identity": { "type": "string", "pattern": "AGE-SECRET-KEY-" },
        "operational_recipient": { "type": "string", "pattern": "^age1[0-9a-z]+$" },
        "recovery_recipients": { "type": "array", "minItems": 1, "uniqueItems": true, "items": { "type": "string", "pattern": "^age1[0-9a-z]+$" } }
      }
    },
    "connection": {
      "type": "object",
      "additionalProperties": false,
      "required": ["provider", "endpoint", "credential_profile"],
      "properties": {
        "display_name": { "type": "string", "minLength": 1 },
        "provider": { "enum": ["r2", "minio"] },
        "endpoint": { "type": "string", "format": "uri", "pattern": "^https?://[^:/@?#][^/@?#]*(?:[/?#].*)?$" },
        "region": { "type": "string" },
        "credential_profile": { "type": "string", "minLength": 1 },
        "auth_state": { "type": "string", "minLength": 1 },
        "session_id": { "type": "string", "minLength": 1 },
        "expires_at": { "type": "string", "minLength": 1 },
        "temporary_credentials": { "type": "boolean", "default": true },
        "multipart_threshold": { "type": "integer", "minimum": 1 },
        "multipart_chunk_size": { "type": "integer", "minimum": 1 },
        "max_bytes": { "type": "integer", "minimum": 1 },
        "timeout_seconds": { "type": "integer", "minimum": 1 },
        "max_attempts": { "type": "integer", "minimum": 1 },
        "verify_tls": { "type": "boolean", "default": true },
        "ca_bundle": { "type": "string" },
        "path_style": { "type": "boolean", "default": true }
      },
      "allOf": [
        { "if": { "properties": { "provider": { "const": "r2" } } }, "then": { "not": { "anyOf": [
          { "required": ["verify_tls"] }, { "required": ["ca_bundle"] }, { "required": ["path_style"] }
        ] } } },
        { "if": { "properties": { "provider": { "const": "minio" } } }, "then": { "not": { "required": ["temporary_credentials"] } } }
      ]
    },
    "dimension": {
      "type": "object",
      "additionalProperties": false,
      "required": ["display_name", "provider", "endpoint", "bucket", "credential_profile"],
      "properties": {
        "auth_state": { "type": "string", "minLength": 1 },
        "encryption_domain_id": { "type": "string", "format": "uuid" },
        "display_name": { "type": "string", "minLength": 1 },
        "provider": { "enum": ["r2", "minio"] },
        "endpoint": { "type": "string", "format": "uri", "pattern": "^https?://[^:/@?#][^/@?#]*(?:[/?#].*)?$" },
        "bucket": { "type": "string", "minLength": 1 },
        "region": { "type": "string" },
        "credential_profile": { "type": "string", "minLength": 1 },
        "catalog_key": { "type": "string", "pattern": "^[A-Za-z0-9][A-Za-z0-9._-]*$" },
        "temporary_credentials": { "type": "boolean", "default": true },
        "multipart_threshold": { "type": "integer", "minimum": 1 },
        "multipart_chunk_size": { "type": "integer", "minimum": 1 },
        "max_bytes": { "type": "integer", "minimum": 1 },
        "timeout_seconds": { "type": "integer", "minimum": 1 },
        "max_attempts": { "type": "integer", "minimum": 1 },
        "verify_tls": { "type": "boolean", "default": true },
        "ca_bundle": { "type": "string" },
        "path_style": { "type": "boolean", "default": true }
      },
      "allOf": [
        {
          "if": { "properties": { "provider": { "const": "r2" } } },
          "then": {
            "not": {
              "anyOf": [
                { "required": ["verify_tls"] },
                { "required": ["ca_bundle"] },
                { "required": ["path_style"] }
              ]
            }
          }
        },
        {
          "if": { "properties": { "provider": { "const": "minio" } } },
          "then": { "not": { "required": ["temporary_credentials"] } }
        }
      ]
    },
    "dimension-reference": {
      "type": "object",
      "additionalProperties": false,
      "required": ["display_name", "connection_id", "bucket"],
      "properties": {
        "display_name": { "type": "string", "minLength": 1 },
        "connection_id": { "type": "string", "pattern": "^[A-Za-z0-9][A-Za-z0-9._-]*$" },
        "bucket": { "type": "string", "minLength": 3, "maxLength": 63, "pattern": "^[a-z0-9](?:[a-z0-9.-]{1,61}[a-z0-9])?$" },
        "catalog_key": { "type": "string", "pattern": "^[A-Za-z0-9][A-Za-z0-9._-]*$" }
      }
    }
  },
  "type": "object",
  "additionalProperties": false,
  "properties": {
    "default_backend": { "enum": ["r2", "minio", "local"] },
    "default_dimension": { "type": "string", "pattern": "^[A-Za-z0-9][A-Za-z0-9._-]*$" },
    "dimensions": {
      "type": "object",
      "propertyNames": { "pattern": "^[A-Za-z0-9][A-Za-z0-9._-]*$" },
      "additionalProperties": { "anyOf": [
        { "$ref": "#/$defs/dimension" },
        { "$ref": "#/$defs/dimension-reference" }
      ] }
    },
    "connections": {
      "type": "object",
      "propertyNames": { "pattern": "^[A-Za-z0-9][A-Za-z0-9._-]*$" },
      "additionalProperties": { "$ref": "#/$defs/connection" }
    },
    "default_ide": { "enum": ["vscode-insiders", "vscode", "terminal"] },
    "workspace_root": { "type": "string", "minLength": 1 },
    "jat_root": { "type": "string", "minLength": 1 },
    "age_identity_profile": { "type": "string", "minLength": 1 },
    "age_recipients": {
      "type": "array",
      "minItems": 2,
      "uniqueItems": true,
      "items": { "type": "string", "minLength": 1 }
    },
    "r2": {
      "type": "object",
      "additionalProperties": false,
      "required": ["endpoint", "bucket", "credential_profile"],
      "properties": {
        "endpoint": { "type": "string", "format": "uri", "pattern": "^https?://[^:/@?#][^/@?#]*(?:[/?#].*)?$" },
        "bucket": { "type": "string", "minLength": 1 },
        "region": { "type": "string" },
        "credential_profile": { "type": "string", "minLength": 1 },
        "catalog_key": { "type": "string", "pattern": "^[A-Za-z0-9._-]+$" },
        "temporary_credentials": { "type": "boolean", "default": true }
      }
    },
    "minio": {
      "type": "object", "additionalProperties": false,
      "required": ["endpoint", "bucket", "credential_profile"],
      "properties": {
        "auth_state": { "type": "string", "minLength": 1 }, "endpoint": { "type": "string", "format": "uri", "pattern": "^https?://[^:/@?#][^/@?#]*(?:[/?#].*)?$" }, "bucket": { "type": "string", "minLength": 1 },
        "region": { "type": "string" }, "credential_profile": { "type": "string", "minLength": 1 },
        "catalog_key": { "type": "string", "pattern": "^[A-Za-z0-9._-]+$" },
        "multipart_threshold": { "type": "integer", "minimum": 1 }, "multipart_chunk_size": { "type": "integer", "minimum": 1 },
        "max_bytes": { "type": "integer", "minimum": 1 }, "timeout_seconds": { "type": "integer", "minimum": 1 }, "max_attempts": { "type": "integer", "minimum": 1 },
        "verify_tls": { "type": "boolean", "default": true }, "ca_bundle": { "type": "string" }, "path_style": { "type": "boolean", "default": true }
      }
    }
  }
}
